{"$schema":"https://json-schema.org/draft/2020-12/schema","$id":"rus.item_profile_sets.v1","type":"array","items":{"type":"object","required":["id","world_revision_id","region_id","context_domain","applicability","status"],"properties":{"id":{"type":"string","minLength":1},"world_revision_id":{"type":"string","minLength":1},"region_id":{"type":"string","minLength":1},"context_domain":{"type":"string","minLength":1},"applicability":{"type":"object","required":["version","mode"],"properties":{"version":{"const":1},"mode":{"const":"draft_authoring"}},"additionalProperties":false},"status":{"enum":["draft","approved","deprecated"]}},"additionalProperties":false}}
